title,video_id,video_url,description
최신 파이썬 코딩 무료 강의 | 2024 점프 투 파이썬 통합본,ftQZo7XaTOA,https://www.youtube.com/watch?v=ftQZo7XaTOA,점프 투 파이썬과 함께하는 파이썬 입문용 코딩 기초 강의로 프로그래밍을 전혀 모르는 왕초보도 누구나 쉽게 코딩을 배울 수 있도록 ...
파이썬 무료 기초 강의 - 1강 파이썬이란 무엇인가?,yytWGELNeOI,https://www.youtube.com/watch?v=yytWGELNeOI,점프 투 파이썬과 함께하는 파이썬 입문용 코딩 기초 강의 1강으로 프로그래밍을 전혀 모르는 왕초보도 누구나 쉽게 코딩을 배울 수 ...
"파이썬 독학, 제발 설치부터 하지 마세요. (서울대 교수 무료 강의) (1/38)",8lCfkW_dIY4,https://www.youtube.com/watch?v=8lCfkW_dIY4,
파이썬 무료 강의 100분 완성 (1분 파이썬 모음),T6z-0dpXPvU,https://www.youtube.com/watch?v=T6z-0dpXPvU,파이썬 1분 파이썬 모음집입니다. 비전공자도 이해할 수 있도록 실습 대신 이론 위주의 컨텐츠로 구성하여 100분 만에 빠르게 파이썬 ...
파이썬 코딩 무료 강의 (기본편) - 6시간 뒤면 여러분도 개발자가 될 수 있어요 [나도코딩],kWiCuklohdY,https://www.youtube.com/watch?v=kWiCuklohdY,파이썬 무료 강의 (기본편)입니다. 누구나 볼 수 있도록 쉽고 재미있게 제작하였습니다. ^^ 파이썬은 다양한 활용 분야가 있는 인기 ...
코딩 왕초보 탈출 무료 강의 Python 기초 1강 ( by 서울대 교수 ),jrHwm-gNg5Y,https://www.youtube.com/watch?v=jrHwm-gNg5Y,00:00 Intro 00:34 코딩이란? 03:49 최초의 코드 짜기 07:43 자료형 14:13 기초연산 22:01 요약.
파이썬 당신이 지금 당장 배워야하는 이유 (파이썬 기초),x1VFfTz30VE,https://www.youtube.com/watch?v=x1VFfTz30VE,"파이썬기초 #코딩 #프로그래밍 파이썬 기초를 배우면 자동화, 웹 개발, 데이터 분석까지 모두 가능해집니다. 파이썬 기초는 반복 업무 ..."
개발자가 보는 프로그래밍 언어좀 해봤다 하는 일반인,59JGaJElY8Y,https://www.youtube.com/watch?v=59JGaJElY8Y,개발 #개발자 #개그 #파이썬 #C언어 #자바.
고수들 github에 나오는 건방진 문법 #python,MeQBuFwdIio,https://www.youtube.com/watch?v=MeQBuFwdIio,
파이썬 코딩 무료 강의 (활용편1) - 추억의 오락실 게임을 만들어 보아요. 3시간이면 충분합니다. [나도코딩],Dkx8Pl6QKW0,https://www.youtube.com/watch?v=Dkx8Pl6QKW0,"【신규 강의 안내】 ✨ 챗GPT를 넘어서, 랭체인과 RAG로 만드는 AI 문서 Q&A 챗봇 강의 https://bit.ly/nadoRAG --- 파이썬 무료 ..."
Python Full Course for Beginners,K5KVEU3aaeQ,https://www.youtube.com/watch?v=K5KVEU3aaeQ,"Master Python from scratch No fluff—just clear, practical coding skills to kickstart your journey! Want to dive deeper? - Check ..."
"파이썬 코딩 기초 강좌 - 파이썬 프로그래밍의 기초, 자료형(2)",2FBX-JcZ2ks,https://www.youtube.com/watch?v=2FBX-JcZ2ks,점프 투 파이썬과 함께하는 파이썬 입문용 코딩 기초 강의 3강으로 프로그래밍을 전혀 모르는 왕초보도 누구나 쉽게 코딩을 배울 수 ...
파이썬 왕초보 기초 강의 완벽 마스터 하는 방법,JE-rdjcNFVQ,https://www.youtube.com/watch?v=JE-rdjcNFVQ,파이썬으로 자동화 프로그램 만들기 강좌 수강 요령을 담은 파이썬 왕초보 기초 강의 완벽 마스터 하는 방법을 공유해봅니다.
Learn Python for FREE in 2025,q2-pnQffZik,https://www.youtube.com/watch?v=q2-pnQffZik,Learn Python for FREE in 2025 #coding #compsci #python #fyp Source: TikTok (individualkex)
Python Syllabus | Python for Beginners | Complete Python Course #pythonlearning,WCM65ION4nE,https://www.youtube.com/watch?v=WCM65ION4nE,Learn Python for free from this own pace learning platform https://cramming.arlarse.tech/c/python-for-beginner #python ...
Python Full Course for Beginners,_uQrJ0TkZlc,https://www.youtube.com/watch?v=_uQrJ0TkZlc,"Learn Python for AI, machine learning, and web development with this beginner-friendly course! Get 6 months of PyCharm ..."
python programming|python for beginners|python full course,80yIVH2aOy0,https://www.youtube.com/watch?v=80yIVH2aOy0,"python programming|python for beginners|python full course @monuinstitute python tutorial, learn python, python basics, ..."
Why This Turtle Graphics Python Tutorial is Worth Your Time,tSZc6Mvqt78,https://www.youtube.com/watch?v=tSZc6Mvqt78,Why This Turtle Graphics Python Tutorial is Worth Your Time @monuinstitute Some of you asked me about Python courses for ...
Impress your crush using Python Code ❤️,fXxUYb0s-pc,https://www.youtube.com/watch?v=fXxUYb0s-pc,Code with explanation is here: https://aitoolz.ai/impress-your-crush-using-python-code/
Learn Python in Only 30 Minutes (Beginner Tutorial),Ro_MScTDfU4,https://www.youtube.com/watch?v=Ro_MScTDfU4,In this video I'm going to be teaching you the core concepts that you need to know to get started with using Python. ▷ Become ...
[1분 파이썬] 2강 연산자(1)_교재제공,zpW543qFsU4,https://www.youtube.com/watch?v=zpW543qFsU4,교재 다운로드- https://blog.naver.com/conding_1_bite #파이썬 #python #강의 #코딩 #교재 #연산자.
Amazing Flower Design using Python turtle 🐢 #python #coding #funny #viral #trending #design,W-8j4MrsX2s,https://www.youtube.com/watch?v=W-8j4MrsX2s,Python Projects for Begineers Python Turtle Programming with Turtle Turtle Graphics Drawing with Python Turtle Python Turtle ...
Python for Beginners - Learn Coding with Python in 1 Hour,kqtD5dpn9C8,https://www.youtube.com/watch?v=kqtD5dpn9C8,"Learn Python basics in just 1 hour! Perfect for beginners interested in AI and coding. ⚡ Plus, get 6 months of PyCharm FREE with ..."
Python Roadmap for Beginners! 🐍 Learn Python Programming Step-by-Step&quot; #python #conding,IfKlGhRc7Dc,https://www.youtube.com/watch?v=IfKlGhRc7Dc,"Python Roadmap for Beginners! Learn Python Programming Step-by-Step"" @MissionAdda4 #codingtutorial #pythonroadmap ..."
How to draw a triangle using turtle in Python,hxgVtGGegC8,https://www.youtube.com/watch?v=hxgVtGGegC8,shorts #Python How to draw a triangle using turtle in Python!
Python Basics: Your FIRST Program in Under a Minute! 🚀,nluUYtejoIE,https://www.youtube.com/watch?v=nluUYtejoIE,"In this quick tutorial, I'll show you how to write your very first line of Python code: the classic ""Hello, World!"" ✨ Whether you're a ..."
👩‍💻 Python for Beginners Tutorial,b093aqAZiPU,https://www.youtube.com/watch?v=b093aqAZiPU,"In this step-by-step Python for beginner's tutorial, learn how you can get started programming in Python. In this video, I assume ..."
Python Tutorial for Beginners - Learn Python in 5 Hours [FULL COURSE],t8pPdKYpowI,https://www.youtube.com/watch?v=t8pPdKYpowI,Grab your free IT Fundamentals Roadmap: https://bit.ly/3GV5Noy Hands-On course to learn the complete SDLC - from code to ...
Python Full Course for free 🐍,ix9cRaBkVe0,https://www.youtube.com/watch?v=ix9cRaBkVe0,python #tutorial #beginners Python tutorial for beginners' full course 2024 *Learn Python in 1 HOUR* ...
Python Basics: The Best Way to Learn Python Programming (2024),GfWRxr1OBm4,https://www.youtube.com/watch?v=GfWRxr1OBm4,Python Basics: The Best Way to Learn Python Programming (2024) @monuinstitute Some of you asked me about Python ...
How I Would Learn Python FAST (if I could start over),mC4nyib2sfg,https://www.youtube.com/watch?v=mC4nyib2sfg,If I had to learn Python again from scratch.. and learn it FAST - this is exactly how I'd do it. After teaching myself Python in just two ...
Apprendre Python en 1 heure - Cours Complet Débutant (4K),5EnpNI2iCZA,https://www.youtube.com/watch?v=5EnpNI2iCZA,RÉCUPÈRE TON KIT DE SURVIE PYTHON (PDF + EXERCICES) : https://www.commentcoder.com/kit/python/ PASSE AU ...
Learn Python in Less than 10 Minutes for Beginners (Fast &amp; Easy),fWjsdhR3z3c,https://www.youtube.com/watch?v=fWjsdhR3z3c,In this crash course I'll be teaching you the basics of Python in less than 10 minutes. Python is super easy to learn compared to ...
Junior vs senior python developer 🐍 | #python #coding #programming #shorts  @Codingknowledge-yt,Mf9GCn_LsUI,https://www.youtube.com/watch?v=Mf9GCn_LsUI,Junior vs senior python developer | #python #coding #javascript #programming @Codingknowledge-yt @Codingknowledge-yt ...
Top 10 Most Important Python Functions You Must Know! 🚀 | Python Tutorial for Beginners,gbYLsUngzLc,https://www.youtube.com/watch?v=gbYLsUngzLc,"In this video, we'll explore the most important Python functions every beginner and intermediate programmer must know! From ..."
Start coding with PYTHON in 5 minutes! 🐍,Sg4GMVMdOPo,https://www.youtube.com/watch?v=Sg4GMVMdOPo,python #pythontutorial #pythoncourse This is the introductory video to my new FREE 12 Hour Python course. There is an ...
Python AI And Generative AI Course For Beginners #ai #python #tutorial #course #study #learning,LRhOzoxHlJo,https://www.youtube.com/watch?v=LRhOzoxHlJo,Python AI And Generative AI Course For Beginners Your Queries :- Learn AI basics with python Generative ai essential full course ...
How to visualize data with Python in Excel. 🤯 #excel  #python #tutorial,EmxXYzX6iEs,https://www.youtube.com/watch?v=EmxXYzX6iEs,
Programming#python#javascript#java#c++#assembly #coding,CMzbwSi8_q8,https://www.youtube.com/watch?v=CMzbwSi8_q8,
Learn Python - Full Course for Beginners [Tutorial],rfscVS0vtbw,https://www.youtube.com/watch?v=rfscVS0vtbw,This course will give you a full introduction into all of the core concepts in python. Follow along with the videos and you'll be a ...
How To Call API In Python,0_zphmXBiZs,https://www.youtube.com/watch?v=0_zphmXBiZs,In this video I will showing you how to Call API in Python if f you know than subscribe the channel and press the thumbs up button ...
Python LAMBDA FUNCTION?! #python #programming #coding,ss-I6WAiMFA,https://www.youtube.com/watch?v=ss-I6WAiMFA,This video shows a quick illustration of what lambda functions are in Python. These are also referred to as anonymous functions.
How to create a virus using python🦠,c0MNpou4zOA,https://www.youtube.com/watch?v=c0MNpou4zOA,"Discover the intricacies of malware creation with Python in this comprehensive guide. Learn how to develop viruses, understand ..."
Python Programming - A Full Course for Beginners (Learn Python in 2025!),Wghz6w0btxI,https://www.youtube.com/watch?v=Wghz6w0btxI,Python Programming - A Full Course for Beginners (Learn Python in 2025!) @monuinstitute Some of you asked me about Python ...
Learn Python in 1 hour! 🐍,8KCuHHeC_M0,https://www.youtube.com/watch?v=8KCuHHeC_M0,python #pythontutorial #pythoncourse This is a quick introduction to the Python programming language. If you would like to learn ...
Pygame - Display Image in Pygame python || Pygame python tutorial #python #pygame,dZ8VrmzYL2A,https://www.youtube.com/watch?v=dZ8VrmzYL2A,Pygame - Display image pygame in python || How to make game using python #shorts #trending #tutorials #python ...
Python pygame Tutorial #python #pygame #coding #programming,UByzZYqOHPY,https://www.youtube.com/watch?v=UByzZYqOHPY,
Do THIS instead of watching endless tutorials - how I’d learn Python FAST…,mB0EBW-vDSQ,https://www.youtube.com/watch?v=mB0EBW-vDSQ,These are two of the best beginner-friendly Python resources I recommend: Python Programming Fundamentals (Datacamp) ...
Python in Excel - Beginner Tutorial,qEwnlMBaLfc,https://www.youtube.com/watch?v=qEwnlMBaLfc,"Learn Excel in just 2 hours: https://kevinstratvert.thinkific.com In this step-by-step tutorial, learn how you can use Python in ..."
Python courses for Beginners (FREE),vMV1s-1BKvc,https://www.youtube.com/watch?v=vMV1s-1BKvc,
